{
  "$schema": "https://json-schema.org/draft/2020-12/schema",
  "$id": "https://woml.dev/schemas/correction-inspection/v1",
  "title": "WOML Correction Inspection v1",
  "type": "object",
  "additionalProperties": false,
  "required": ["profile", "runId", "phase", "originalOutcome", "sagas", "unresolvedActions", "truncated"],
  "properties": {
    "profile": { "const": "woml.correction-inspection/v1" },
    "runId": { "type": "string", "minLength": 1 },
    "phase": { "enum": ["forward", "compensating", "cleanup", "completed", "manual_recovery"] },
    "originalOutcome": { "enum": ["running", "succeeded", "failed", "cancelled"] },
    "sagas": { "type": "array", "maxItems": 64 },
    "unresolvedActions": { "type": "array", "maxItems": 100 },
    "truncated": { "type": "boolean" }
  }
}
